{
  "assets": [],
  "category": "ERC",
  "eip": "EIP-6786",
  "erc": "ERC-6786",
  "events": [
    {
      "name": "RoyaltiesPaid",
      "signature": "RoyaltiesPaid(address,uint256,uint256)"
    }
  ],
  "functions": [
    {
      "name": "payRoyalties",
      "operation_type": "contract_interaction",
      "signature": "payRoyalties(address,uint256)"
    },
    {
      "name": "getPaidRoyalties",
      "operation_type": "contract_interaction",
      "signature": "getPaidRoyalties(address,uint256)"
    }
  ],
  "id": "ERC6786",
  "security_properties": [],
  "source": {
    "canonical_url": "https://eips.ethereum.org/EIPS/eip-6786",
    "raw_path": "D:\\Recherche\\MBTSecurityTesting for Smart contracts\\MAS4MBTS\\knowledge_base\\raw\\ercs\\ERCS\\erc-6786.md",
    "source_id": "ethereum_ercs_repo"
  },
  "status": "Draft",
  "summary": "This standard allows anyone to pay royalties for a certain NFT and also to keep track of the royalties amount paid. It will cumulate the value each time a payment is executed through it and make the information public.",
  "title": "Registry for royalties payment for NFTs"
}