{
  "assets": [],
  "category": "ERC",
  "eip": "EIP-927",
  "erc": "ERC-927",
  "events": [],
  "functions": [
    {
      "name": "canCall",
      "operation_type": "contract_interaction",
      "signature": "canCall(address,address,address,bytes4)"
    },
    {
      "name": "authoriseCaller",
      "operation_type": "contract_interaction",
      "signature": "authoriseCaller(address,address,address,bytes4)"
    },
    {
      "name": "revokeCaller",
      "operation_type": "contract_interaction",
      "signature": "revokeCaller(address,address,address,bytes4)"
    }
  ],
  "id": "ERC927",
  "security_properties": [],
  "source": {
    "canonical_url": "https://eips.ethereum.org/EIPS/eip-927",
    "raw_path": "D:\\Recherche\\MBTSecurityTesting for Smart contracts\\MAS4MBTS\\knowledge_base\\raw\\ercs\\ERCS\\erc-927.md",
    "source_id": "ethereum_ercs_repo"
  },
  "status": "Stagnant",
  "summary": "This EIP specifies a generic authorisation mechanism, which can be used to implement a variety of authorisation patterns, replacing approvals in ERC20, operators in ERC777, and bespoke authorisation patterns in a variety of other types of contract.",
  "title": "Generalised authorisations"
}