{
  "assets": [],
  "category": "ERC",
  "eip": "EIP-8152",
  "erc": "ERC-8152",
  "events": [],
  "functions": [
    {
      "name": "decimals",
      "operation_type": "contract_interaction",
      "signature": "decimals()"
    }
  ],
  "id": "ERC8152",
  "security_properties": [],
  "source": {
    "canonical_url": "https://eips.ethereum.org/EIPS/eip-8152",
    "raw_path": "D:\\Recherche\\MBTSecurityTesting for Smart contracts\\MAS4MBTS\\knowledge_base\\raw\\ercs\\ERCS\\erc-8152.md",
    "source_id": "ethereum_ercs_repo"
  },
  "status": "Review",
  "summary": "This standard defines Content-Addressable Logic Modules (CALM) - minimal, deterministic blocks of code designed for execution via delegatecall within Diamond ([ERC-2535](./eip-2535.md), [ERC-8153](./eip-8153.md)), UUPS ([ERC-1822](./eip-1822.md)), Modular Dispatch Proxies ([ERC-8167](./eip-8167.md)) and other proxy architectures. A CALM's address is a direct cryptographic commitment to its runtime bytecode. By eliminating deployment-side effects (initialisation code - constructors, immutables), CALM ensures that identical logic resides at identical addresses across all EVM chains. Runtime Bytecode is Identity.",
  "title": "Content-Addressable Logic Modules (CALM)"
}